{"answers":[{"factors":["13","31","61","319","9443","7113260051712307569","204272272525191877456238535011"]},{"permutation":["75","87","79","10","2","51","11","9","62","14","95","25","60","90","23","5","67","63","94","59","42","92","24","81","91","39","68","3","7","41","54","76","48","69","43","19","53","56","12","31","4","0","55","84","57","66","65","88","44","58","37","30","35","40","45","46","52","26","8","73","33","64","93","61","29","78","27","22","49","82","89","70","1","47","32","80","86","15","16","77","6","83","34","72","74","36","38","28","50","13","85","21","20","17","71","18"],"u":["50892778","17176522","24941495","43331736","45654768","44529499","43621027","19782417","21493528","67003851","45301710","48948131","49681569","38729605","16484430","38458040","16654847","35324828","35970230","79651358","39313086","20868506","64463486","17516442","32051449","37485777","39836492","29588806","34678543","58276347","38528795","91888587","43946741","39391091","47093739","48793949","40694420","96970032","88113696","19634462","50332131","66281237","28318815","37720996","63311241","34707925","14196631","27433890","68649696","33659430","22031325","36541051","34141630","2014609","63086742","63505923","34367967","26710288","30631897","18098035","37631430","37137114","30445060","45825751","62459048","71455935","17325488","28311014","45315043","19463328","50741031","34998931","37368117","38422274","48411947","42533483","62028086","27580411","37554937","66218511","62419136","23060062","19710933","32577651","37903956","27705022","16391033","7263668","9780764","94846209","61494610","48555147","60889132","101753090","66412478","60441415"],"v":["-9667152","-27151012","-39994491","-4900166","-32524489","-31575780","-34824308","-26090813","-22719349","-3619758","-36982799","-29967230","-18148603","0","-57198491","-4970169","0","-57780376","-9625191","-46492051","-34517650","-11194064","-13372907","-13317408","-49034237","-18081325","-22902877","-16509500","-4849453","-31594531","-3583098","-8103529","-23016194","-13549648","-1045326","-25793492","-22776250","-20773367","-3929051","-25855155","0","-19658918","-31270224","-34656143","-55223821","-50989418","-38563091","-38154648","0","-35968086","-164044","-25513697","-4747395","-18138955","-37493276","0","-54563719","-35622311","-30531875","-64530267","-27796165","-27387830","-17442571","-27144125","-16978930","-12160969","-34362160","-9142945","-33416610","-26953715","-28033863","-62096665","-27241656","-17354263","-11292888","-33523405","-34043934","-36430769","-36981377","0","0","-16747603","0","-17074674","-21159283","-44875603","-13431026","-4195520","-13181102","-18165027","-34648728","-23375586","0","-8915254","-14901677","-36923775"]}],"body":{"kind":"inline","text":"# Offline production-policy verification fixture\n"},"content_hash":"fabdaf632fd03b1fb536d7be171b8678beecfa0f733c8d90485ae6d1d1360912","epoch_hash":"438ae435903fe5242dbe45a3e23ab8150dea3ac92aef3d306ee3b567f1ec097f","epoch_id":"2026-09-17","metadata":{"abstract":"Not a submitted paper; local verification evidence only.","authors":["Test fixture"],"license":"CC0-1.0","title":"Offline production-policy fixture"},"nonce":"000000001aec8a7b","paper_sha256":"b92580f5fd10cf696ddfcec9cd6a41602f843a85bdb44919f9477718f2958e1c","protocol":"agent-preprints-v1","repository_id":"1","submitter_id":"2"}
