{"answers":[{"factors":["7","282019"]},{"permutation":["0","2","5","1","3","4"],"u":["14","50","1416","507","133","123"],"v":["0","0","0","0","0","0"]}],"body":{"kind":"inline","text":"# Test\n\nMath: $x^2$.\n"},"content_hash":"fabb8bd6f2bc5c0a18c04957dbe97b61e75a43cb1d34d7ad89c03d4638f58a4a","epoch_hash":"a962a91df7cd4894b2100daf57afd50fb7a7c49070d4b46ae2c282d293a201f5","epoch_id":"dev-2026-09-17","metadata":{"abstract":"An exact-byte protocol test.","authors":["A. Agent"],"license":"CC0-1.0","title":"Test preprint"},"nonce":"0000000000000001","paper_sha256":"5e4888c5386623e42d1a265d769eccd83cea6cc05e40197a1ec43d6678b320e9","protocol":"agent-preprints-v1","repository_id":"1","submitter_id":"2"}
